[
  {
    "id": "Strike",
    "name": "Strike",
    "type": "Attack",
    "rarity": "Basic",
    "target": "AnyEnemy",
    "exhaust": false,
    "base": {
      "cost": 1,
      "damage": 6,
      "block": 0,
      "draw": 0,
      "energy": 0,
      "focus": 0
    },
    "upgrade": {
      "cost": 1,
      "damage": 9,
      "block": 0,
      "draw": 0,
      "energy": 0,
      "focus": 0
    }
  },
  {
    "id": "Guard",
    "name": "Guard",
    "type": "Skill",
    "rarity": "Basic",
    "target": "Self",
    "exhaust": false,
    "base": {
      "cost": 1,
      "damage": 0,
      "block": 5,
      "draw": 0,
      "energy": 0,
      "focus": 0
    },
    "upgrade": {
      "cost": 1,
      "damage": 0,
      "block": 8,
      "draw": 0,
      "energy": 0,
      "focus": 0
    }
  },
  {
    "id": "Practice",
    "name": "Practice",
    "type": "Skill",
    "rarity": "Basic",
    "target": "Self",
    "exhaust": true,
    "base": {
      "cost": 1,
      "damage": 0,
      "block": 0,
      "draw": 0,
      "energy": 0,
      "focus": 1
    },
    "upgrade": {
      "cost": 1,
      "damage": 0,
      "block": 0,
      "draw": 0,
      "energy": 0,
      "focus": 2
    }
  },
  {
    "id": "Swing",
    "name": "Swing",
    "type": "Attack",
    "rarity": "Common",
    "target": "AnyEnemy",
    "exhaust": false,
    "base": {
      "cost": 1,
      "damage": 9,
      "block": 0,
      "draw": 0,
      "energy": 0,
      "focus": 0
    },
    "upgrade": {
      "cost": 1,
      "damage": 12,
      "block": 0,
      "draw": 0,
      "energy": 0,
      "focus": 0
    }
  },
  {
    "id": "Breathe",
    "name": "Breathe",
    "type": "Skill",
    "rarity": "Uncommon",
    "target": "Self",
    "exhaust": false,
    "base": {
      "cost": 1,
      "damage": 0,
      "block": 0,
      "draw": 2,
      "energy": 0,
      "focus": 0
    },
    "upgrade": {
      "cost": 1,
      "damage": 0,
      "block": 0,
      "draw": 3,
      "energy": 0,
      "focus": 0
    }
  },
  {
    "id": "Composure",
    "name": "Composure",
    "type": "Power",
    "rarity": "Rare",
    "target": "Self",
    "exhaust": false,
    "base": {
      "cost": 2,
      "damage": 0,
      "block": 0,
      "draw": 0,
      "energy": 0,
      "focus": 2
    },
    "upgrade": {
      "cost": 2,
      "damage": 0,
      "block": 0,
      "draw": 0,
      "energy": 0,
      "focus": 3
    }
  },
  {
    "id": "Lunge",
    "name": "Lunge",
    "type": "Attack",
    "rarity": "Common",
    "target": "AnyEnemy",
    "exhaust": false,
    "base": {
      "cost": 2,
      "damage": 14,
      "block": 0,
      "draw": 0,
      "energy": 0,
      "focus": 0
    },
    "upgrade": {
      "cost": 2,
      "damage": 19,
      "block": 0,
      "draw": 0,
      "energy": 0,
      "focus": 0
    }
  },
  {
    "id": "Brace",
    "name": "Brace",
    "type": "Skill",
    "rarity": "Common",
    "target": "Self",
    "exhaust": false,
    "base": {
      "cost": 1,
      "damage": 0,
      "block": 8,
      "draw": 0,
      "energy": 0,
      "focus": 0
    },
    "upgrade": {
      "cost": 1,
      "damage": 0,
      "block": 11,
      "draw": 0,
      "energy": 0,
      "focus": 0
    }
  },
  {
    "id": "MeasuredJab",
    "name": "Measured Jab",
    "rarity": "Common",
    "type": "Attack",
    "target": "AnyEnemy",
    "exhaust": false,
    "base": {
      "cost": 1,
      "damage": 7,
      "block": 3,
      "draw": 0,
      "energy": 0,
      "focus": 0
    },
    "upgrade": {
      "cost": 1,
      "damage": 10,
      "block": 4,
      "draw": 0,
      "energy": 0,
      "focus": 0
    }
  },
  {
    "id": "GuardedStep",
    "name": "Guarded Step",
    "rarity": "Common",
    "type": "Attack",
    "target": "AnyEnemy",
    "exhaust": false,
    "base": {
      "cost": 1,
      "damage": 5,
      "block": 5,
      "draw": 0,
      "energy": 0,
      "focus": 0
    },
    "upgrade": {
      "cost": 1,
      "damage": 7,
      "block": 7,
      "draw": 0,
      "energy": 0,
      "focus": 0
    }
  },
  {
    "id": "TrailSweep",
    "name": "Trail Sweep",
    "rarity": "Common",
    "type": "Attack",
    "target": "AllEnemies",
    "exhaust": false,
    "base": {
      "cost": 1,
      "damage": 5,
      "block": 0,
      "draw": 0,
      "energy": 0,
      "focus": 0
    },
    "upgrade": {
      "cost": 1,
      "damage": 8,
      "block": 0,
      "draw": 0,
      "energy": 0,
      "focus": 0
    }
  },
  {
    "id": "QuickRead",
    "name": "Quick Read",
    "rarity": "Common",
    "type": "Attack",
    "target": "AnyEnemy",
    "exhaust": false,
    "base": {
      "cost": 1,
      "damage": 5,
      "block": 0,
      "draw": 1,
      "energy": 0,
      "focus": 0
    },
    "upgrade": {
      "cost": 1,
      "damage": 8,
      "block": 0,
      "draw": 1,
      "energy": 0,
      "focus": 0
    }
  },
  {
    "id": "PassingTap",
    "name": "Passing Tap",
    "rarity": "Common",
    "type": "Attack",
    "target": "AnyEnemy",
    "exhaust": false,
    "base": {
      "cost": 0,
      "damage": 3,
      "block": 0,
      "draw": 0,
      "energy": 0,
      "focus": 0
    },
    "upgrade": {
      "cost": 0,
      "damage": 5,
      "block": 0,
      "draw": 0,
      "energy": 0,
      "focus": 0
    }
  },
  {
    "id": "BracedSwing",
    "name": "Braced Swing",
    "rarity": "Common",
    "type": "Attack",
    "target": "AnyEnemy",
    "exhaust": false,
    "base": {
      "cost": 2,
      "damage": 12,
      "block": 5,
      "draw": 0,
      "energy": 0,
      "focus": 0
    },
    "upgrade": {
      "cost": 2,
      "damage": 16,
      "block": 7,
      "draw": 0,
      "energy": 0,
      "focus": 0
    }
  },
  {
    "id": "StudyTheOpening",
    "name": "Study The Opening",
    "rarity": "Common",
    "type": "Attack",
    "target": "AnyEnemy",
    "exhaust": true,
    "base": {
      "cost": 1,
      "damage": 7,
      "block": 0,
      "draw": 0,
      "energy": 0,
      "focus": 1
    },
    "upgrade": {
      "cost": 1,
      "damage": 10,
      "block": 0,
      "draw": 0,
      "energy": 0,
      "focus": 1
    }
  },
  {
    "id": "LongStride",
    "name": "Long Stride",
    "rarity": "Common",
    "type": "Attack",
    "target": "AnyEnemy",
    "exhaust": false,
    "base": {
      "cost": 2,
      "damage": 18,
      "block": 0,
      "draw": 0,
      "energy": 0,
      "focus": 0
    },
    "upgrade": {
      "cost": 2,
      "damage": 23,
      "block": 0,
      "draw": 0,
      "energy": 0,
      "focus": 0
    }
  },
  {
    "id": "CircleCut",
    "name": "Circle Cut",
    "rarity": "Common",
    "type": "Attack",
    "target": "AllEnemies",
    "exhaust": false,
    "base": {
      "cost": 2,
      "damage": 8,
      "block": 3,
      "draw": 0,
      "energy": 0,
      "focus": 0
    },
    "upgrade": {
      "cost": 2,
      "damage": 11,
      "block": 5,
      "draw": 0,
      "energy": 0,
      "focus": 0
    }
  },
  {
    "id": "Staccato",
    "name": "Staccato",
    "rarity": "Common",
    "type": "Attack",
    "target": "AnyEnemy",
    "exhaust": false,
    "base": {
      "cost": 1,
      "damage": 4,
      "block": 0,
      "draw": 0,
      "energy": 1,
      "focus": 0
    },
    "upgrade": {
      "cost": 1,
      "damage": 6,
      "block": 0,
      "draw": 0,
      "energy": 1,
      "focus": 0
    }
  },
  {
    "id": "ClosingBlow",
    "name": "Closing Blow",
    "rarity": "Common",
    "type": "Attack",
    "target": "AnyEnemy",
    "exhaust": true,
    "base": {
      "cost": 1,
      "damage": 15,
      "block": 0,
      "draw": 0,
      "energy": 0,
      "focus": 0
    },
    "upgrade": {
      "cost": 1,
      "damage": 20,
      "block": 0,
      "draw": 0,
      "energy": 0,
      "focus": 0
    }
  },
  {
    "id": "ReadTheRoad",
    "name": "Read The Road",
    "rarity": "Common",
    "type": "Skill",
    "target": "Self",
    "exhaust": false,
    "base": {
      "cost": 1,
      "damage": 0,
      "block": 4,
      "draw": 1,
      "energy": 0,
      "focus": 0
    },
    "upgrade": {
      "cost": 1,
      "damage": 0,
      "block": 7,
      "draw": 1,
      "energy": 0,
      "focus": 0
    }
  },
  {
    "id": "CatchBreath",
    "name": "Catch Breath",
    "rarity": "Common",
    "type": "Skill",
    "target": "Self",
    "exhaust": false,
    "base": {
      "cost": 0,
      "damage": 0,
      "block": 3,
      "draw": 0,
      "energy": 0,
      "focus": 0
    },
    "upgrade": {
      "cost": 0,
      "damage": 0,
      "block": 5,
      "draw": 0,
      "energy": 0,
      "focus": 0
    }
  },
  {
    "id": "QuietPractice",
    "name": "Quiet Practice",
    "rarity": "Common",
    "type": "Skill",
    "target": "Self",
    "exhaust": true,
    "base": {
      "cost": 1,
      "damage": 0,
      "block": 3,
      "draw": 0,
      "energy": 0,
      "focus": 1
    },
    "upgrade": {
      "cost": 1,
      "damage": 0,
      "block": 6,
      "draw": 0,
      "energy": 0,
      "focus": 1
    }
  },
  {
    "id": "TrailRations",
    "name": "Trail Rations",
    "rarity": "Common",
    "type": "Skill",
    "target": "Self",
    "exhaust": true,
    "base": {
      "cost": 0,
      "damage": 0,
      "block": 0,
      "draw": 0,
      "energy": 1,
      "focus": 0
    },
    "upgrade": {
      "cost": 0,
      "damage": 0,
      "block": 0,
      "draw": 0,
      "energy": 2,
      "focus": 0
    }
  },
  {
    "id": "FirmFooting",
    "name": "Firm Footing",
    "rarity": "Common",
    "type": "Skill",
    "target": "Self",
    "exhaust": false,
    "base": {
      "cost": 2,
      "damage": 0,
      "block": 15,
      "draw": 0,
      "energy": 0,
      "focus": 0
    },
    "upgrade": {
      "cost": 2,
      "damage": 0,
      "block": 20,
      "draw": 0,
      "energy": 0,
      "focus": 0
    }
  },
  {
    "id": "PackLight",
    "name": "Pack Light",
    "rarity": "Common",
    "type": "Skill",
    "target": "Self",
    "exhaust": true,
    "base": {
      "cost": 0,